{
  "$comment": "Requirement IDs: HEE-SHOW-01, HEE-SHOW-02, HEE-SHOW-03, HEE-SHOW-04, HEE-CLAIM-01 | Owned by DP-W09 | Captions for showcase stills: one sentence, ends with a period, at most 140 characters, no semicolon (full rule checked by code; length checked here).",
  "$id": "https://chassis/contracts/hee-captions.schema.json",
  "$schema": "https://json-schema.org/draft/2020-12/schema",
  "title": "HeeCaptions",
  "type": "array",
  "items": {
    "type": "object",
    "additionalProperties": false,
    "required": ["file", "caption", "alt", "claim_id", "size"],
    "properties": {
      "file": { "type": "string", "minLength": 1 },
      "caption": { "type": "string", "minLength": 1, "maxLength": 140 },
      "alt": { "type": "string", "minLength": 1 },
      "claim_id": { "type": ["string", "null"] },
      "size": { "type": "string", "enum": ["gallery", "readme", "hero"] }
    }
  }
}
